{
  "manifestVersion": 1,
  "modelGeneration": "album-photo-canvas-v1",
  "canonicalPage": {
    "width": 2400,
    "height": 3000
  },
  "templates": [
    {
      "id": "layout.p1.caption-a",
      "version": 1,
      "isActive": true,
      "localizedNameKey": "layout.p1.caption-a.name",
      "slots": [
        {
          "id": "text-1",
          "kind": "text",
          "geometry": {
            "centerX": 0.5,
            "centerY": 0.115,
            "width": 0.78,
            "height": 0.12,
            "rotationRadians": 0
          },
          "readingOrder": 0
        },
        {
          "id": "photo-1",
          "kind": "photo",
          "geometry": {
            "centerX": 0.5,
            "centerY": 0.58,
            "width": 0.441,
            "height": 0.74,
            "rotationRadians": 0
          },
          "readingOrder": 1
        }
      ]
    },
    {
      "id": "layout.p1.caption-b",
      "version": 1,
      "isActive": true,
      "localizedNameKey": "layout.p1.caption-b.name",
      "slots": [
        {
          "id": "photo-1",
          "kind": "photo",
          "geometry": {
            "centerX": 0.5,
            "centerY": 0.42,
            "width": 0.84,
            "height": 0.74,
            "rotationRadians": 0.025
          },
          "readingOrder": 0
        },
        {
          "id": "text-1",
          "kind": "text",
          "geometry": {
            "centerX": 0.5,
            "centerY": 0.885,
            "width": 0.78,
            "height": 0.12,
            "rotationRadians": 0
          },
          "readingOrder": 1
        }
      ]
    },
    {
      "id": "layout.p1.grid-a",
      "version": 1,
      "isActive": true,
      "localizedNameKey": "layout.p1.grid-a.name",
      "slots": [
        {
          "id": "photo-1",
          "kind": "photo",
          "geometry": {
            "centerX": 0.5,
            "centerY": 0.5,
            "width": 0.441,
            "height": 0.9,
            "rotationRadians": 0
          },
          "readingOrder": 0
        }
      ]
    },
    {
      "id": "layout.p1.grid-b",
      "version": 1,
      "isActive": true,
      "localizedNameKey": "layout.p1.grid-b.name",
      "slots": [
        {
          "id": "photo-1",
          "kind": "photo",
          "geometry": {
            "centerX": 0.5,
            "centerY": 0.5,
            "width": 0.84,
            "height": 0.9,
            "rotationRadians": 0.025
          },
          "readingOrder": 0
        }
      ]
    },
    {
      "id": "layout.p2.caption-a",
      "version": 1,
      "isActive": true,
      "localizedNameKey": "layout.p2.caption-a.name",
      "slots": [
        {
          "id": "text-1",
          "kind": "text",
          "geometry": {
            "centerX": 0.5,
            "centerY": 0.115,
            "width": 0.78,
            "height": 0.12,
            "rotationRadians": 0
          },
          "readingOrder": 0
        },
        {
          "id": "photo-1",
          "kind": "photo",
          "geometry": {
            "centerX": 0.2705,
            "centerY": 0.58,
            "width": 0.441,
            "height": 0.74,
            "rotationRadians": 0
          },
          "readingOrder": 1
        },
        {
          "id": "photo-2",
          "kind": "photo",
          "geometry": {
            "centerX": 0.7295,
            "centerY": 0.58,
            "width": 0.441,
            "height": 0.74,
            "rotationRadians": 0
          },
          "readingOrder": 2
        }
      ]
    },
    {
      "id": "layout.p2.caption-b",
      "version": 1,
      "isActive": true,
      "localizedNameKey": "layout.p2.caption-b.name",
      "slots": [
        {
          "id": "photo-1",
          "kind": "photo",
          "geometry": {
            "centerX": 0.2855,
            "centerY": 0.42,
            "width": 0.411,
            "height": 0.74,
            "rotationRadians": 0
          },
          "readingOrder": 0
        },
        {
          "id": "photo-2",
          "kind": "photo",
          "geometry": {
            "centerX": 0.7145,
            "centerY": 0.42,
            "width": 0.411,
            "height": 0.74,
            "rotationRadians": 0
          },
          "readingOrder": 1
        },
        {
          "id": "text-1",
          "kind": "text",
          "geometry": {
            "centerX": 0.5,
            "centerY": 0.885,
            "width": 0.78,
            "height": 0.12,
            "rotationRadians": 0
          },
          "readingOrder": 2
        }
      ]
    },
    {
      "id": "layout.p2.grid-a",
      "version": 1,
      "isActive": true,
      "localizedNameKey": "layout.p2.grid-a.name",
      "slots": [
        {
          "id": "photo-1",
          "kind": "photo",
          "geometry": {
            "centerX": 0.2705,
            "centerY": 0.5,
            "width": 0.441,
            "height": 0.9,
            "rotationRadians": 0
          },
          "readingOrder": 0
        },
        {
          "id": "photo-2",
          "kind": "photo",
          "geometry": {
            "centerX": 0.7295,
            "centerY": 0.5,
            "width": 0.441,
            "height": 0.9,
            "rotationRadians": 0
          },
          "readingOrder": 1
        }
      ]
    },
    {
      "id": "layout.p2.grid-b",
      "version": 1,
      "isActive": true,
      "localizedNameKey": "layout.p2.grid-b.name",
      "slots": [
        {
          "id": "photo-1",
          "kind": "photo",
          "geometry": {
            "centerX": 0.2855,
            "centerY": 0.5,
            "width": 0.411,
            "height": 0.9,
            "rotationRadians": 0
          },
          "readingOrder": 0
        },
        {
          "id": "photo-2",
          "kind": "photo",
          "geometry": {
            "centerX": 0.7145,
            "centerY": 0.5,
            "width": 0.411,
            "height": 0.9,
            "rotationRadians": 0
          },
          "readingOrder": 1
        }
      ]
    },
    {
      "id": "layout.p3.caption-a",
      "version": 1,
      "isActive": true,
      "localizedNameKey": "layout.p3.caption-a.name",
      "slots": [
        {
          "id": "text-1",
          "kind": "text",
          "geometry": {
            "centerX": 0.5,
            "centerY": 0.115,
            "width": 0.78,
            "height": 0.12,
            "rotationRadians": 0
          },
          "readingOrder": 0
        },
        {
          "id": "photo-1",
          "kind": "photo",
          "geometry": {
            "centerX": 0.2705,
            "centerY": 0.3905,
            "width": 0.441,
            "height": 0.361,
            "rotationRadians": 0
          },
          "readingOrder": 1
        },
        {
          "id": "photo-2",
          "kind": "photo",
          "geometry": {
            "centerX": 0.7295,
            "centerY": 0.3905,
            "width": 0.441,
            "height": 0.361,
            "rotationRadians": 0
          },
          "readingOrder": 2
        },
        {
          "id": "photo-3",
          "kind": "photo",
          "geometry": {
            "centerX": 0.5,
            "centerY": 0.7695,
            "width": 0.441,
            "height": 0.361,
            "rotationRadians": 0
          },
          "readingOrder": 3
        }
      ]
    },
    {
      "id": "layout.p3.caption-b",
      "version": 1,
      "isActive": true,
      "localizedNameKey": "layout.p3.caption-b.name",
      "slots": [
        {
          "id": "photo-1",
          "kind": "photo",
          "geometry": {
            "centerX": 0.2855,
            "centerY": 0.2305,
            "width": 0.411,
            "height": 0.361,
            "rotationRadians": 0
          },
          "readingOrder": 0
        },
        {
          "id": "photo-2",
          "kind": "photo",
          "geometry": {
            "centerX": 0.7145,
            "centerY": 0.2305,
            "width": 0.411,
            "height": 0.361,
            "rotationRadians": 0
          },
          "readingOrder": 1
        },
        {
          "id": "photo-3",
          "kind": "photo",
          "geometry": {
            "centerX": 0.5,
            "centerY": 0.6095,
            "width": 0.411,
            "height": 0.361,
            "rotationRadians": 0
          },
          "readingOrder": 2
        },
        {
          "id": "text-1",
          "kind": "text",
          "geometry": {
            "centerX": 0.5,
            "centerY": 0.885,
            "width": 0.78,
            "height": 0.12,
            "rotationRadians": 0
          },
          "readingOrder": 3
        }
      ]
    },
    {
      "id": "layout.p3.grid-a",
      "version": 1,
      "isActive": true,
      "localizedNameKey": "layout.p3.grid-a.name",
      "slots": [
        {
          "id": "photo-1",
          "kind": "photo",
          "geometry": {
            "centerX": 0.2705,
            "centerY": 0.2705,
            "width": 0.441,
            "height": 0.441,
            "rotationRadians": 0
          },
          "readingOrder": 0
        },
        {
          "id": "photo-2",
          "kind": "photo",
          "geometry": {
            "centerX": 0.7295,
            "centerY": 0.2705,
            "width": 0.441,
            "height": 0.441,
            "rotationRadians": 0
          },
          "readingOrder": 1
        },
        {
          "id": "photo-3",
          "kind": "photo",
          "geometry": {
            "centerX": 0.5,
            "centerY": 0.7295,
            "width": 0.441,
            "height": 0.441,
            "rotationRadians": 0
          },
          "readingOrder": 2
        }
      ]
    },
    {
      "id": "layout.p3.grid-b",
      "version": 1,
      "isActive": true,
      "localizedNameKey": "layout.p3.grid-b.name",
      "slots": [
        {
          "id": "photo-1",
          "kind": "photo",